{
  "$schema": "https://json-schema.org/draft/2020-12/schema",
  "$id": "https://api-evangelist.github.io/amazon-application-migration-service/json-schema/application-migration-service-update-replication-configuration-template-request-schema.json",
  "title": "UpdateReplicationConfigurationTemplateRequest",
  "description": "Request to update a replication configuration template",
  "type": "object",
  "properties": {
    "replicationConfigurationTemplateID": {
      "type": "string",
      "description": "Template ID to update"
    },
    "stagingAreaSubnetId": {
      "type": "string",
      "description": "stagingAreaSubnetId"
    },
    "associateDefaultSecurityGroup": {
      "type": "boolean",
      "description": "associateDefaultSecurityGroup"
    },
    "replicationServerInstanceType": {
      "type": "string",
      "description": "replicationServerInstanceType"
    },
    "useLowBandwidthForReplication": {
      "type": "boolean",
      "description": "useLowBandwidthForReplication"
    },
    "dataPlaneRouting": {
      "type": "string",
      "description": "dataPlaneRouting"
    },
    "createPublicIP": {
      "type": "boolean",
      "description": "createPublicIP"
    }
  }
}