{
  "replicationConfigurationTemplateID": "rct-1234567890abcdef0",
  "stagingAreaSubnetId": "subnet-1234567890abcdef0",
  "associateDefaultSecurityGroup": true,
  "replicationServerInstanceType": "t3.medium",
  "useLowBandwidthForReplication": false,
  "dataPlaneRouting": "PRIVATE_IP",
  "createPublicIP": false
}